{
  "target_contract_version": "toy-quality-fixed-cpu-target/1.0",
  "target_name": "planning-model-canonical-cpu-v1",
  "os": "Linux",
  "os_version": "Ubuntu 24.04.4 LTS",
  "kernel_policy": {
    "mode": "exact",
    "value": "6.17.0-1017-aws"
  },
  "architecture": "x86_64",
  "cpu_vendor": "GenuineIntel",
  "cpu_family": "6",
  "cpu_model": "143",
  "cpu_stepping": "8",
  "cpu_model_name": "Intel(R) Xeon(R) Platinum 8488C",
  "microcode_policy": {
    "mode": "exact",
    "value": "0x2b000661"
  },
  "required_cpu_flags": [
    "3dnowprefetch",
    "abm",
    "adx",
    "aes",
    "amx_bf16",
    "amx_int8",
    "amx_tile",
    "apic",
    "arat",
    "arch_capabilities",
    "avx",
    "avx2",
    "avx512_bf16",
    "avx512_bitalg",
    "avx512_fp16",
    "avx512_vbmi2",
    "avx512_vnni",
    "avx512_vpopcntdq",
    "avx512bw",
    "avx512cd",
    "avx512dq",
    "avx512f",
    "avx512ifma",
    "avx512vbmi",
    "avx512vl",
    "avx_vnni",
    "bmi1",
    "bmi2",
    "cldemote",
    "clflush",
    "clflushopt",
    "clwb",
    "cmov",
    "constant_tsc",
    "cpuid",
    "cpuid_fault",
    "cx16",
    "cx8",
    "de",
    "erms",
    "f16c",
    "flush_l1d",
    "fma",
    "fpu",
    "fsgsbase",
    "fxsr",
    "gfni",
    "ht",
    "hypervisor",
    "ibpb",
    "ibrs",
    "ibrs_enhanced",
    "ida",
    "invpcid",
    "lahf_lm",
    "lm",
    "mca",
    "mce",
    "md_clear",
    "mmx",
    "movbe",
    "movdir64b",
    "movdiri",
    "msr",
    "mtrr",
    "nonstop_tsc",
    "nopl",
    "nx",
    "ospke",
    "pae",
    "pat",
    "pcid",
    "pclmulqdq",
    "pdcm",
    "pdpe1gb",
    "pge",
    "pku",
    "pni",
    "popcnt",
    "pse",
    "pse36",
    "rdpid",
    "rdrand",
    "rdseed",
    "rdtscp",
    "rep_good",
    "sep",
    "serialize",
    "sha_ni",
    "smap",
    "smep",
    "ss",
    "ssbd",
    "sse",
    "sse2",
    "sse4_1",
    "sse4_2",
    "ssse3",
    "stibp",
    "syscall",
    "tme",
    "tsc",
    "tsc_adjust",
    "tsc_deadline_timer",
    "tsc_known_freq",
    "umip",
    "vaes",
    "vme",
    "vpclmulqdq",
    "waitpkg",
    "wbnoinvd",
    "x2apic",
    "xgetbv1",
    "xsave",
    "xsavec",
    "xsaveopt",
    "xsaves",
    "xtopology"
  ],
  "forbidden_or_irrelevant_flags_policy": {
    "mode": "ignore-unlisted-reject-forbidden",
    "forbidden_flags": []
  },
  "logical_cpu_count_policy": {
    "mode": "exact",
    "value": 2
  },
  "runner_type": "self-hosted-dedicated",
  "required_runner_labels": [
    "linux",
    "planning-model-canonical-cpu-v1",
    "self-hosted",
    "x64"
  ],
  "runner_image": "planning-model-canonical-cpu-v1|provider=aws-ec2|instance=i-0ef4e446bfb12ce21|ami=ami-05bfa4a7765f38076|type=m7i-flex.large|runtime=1.1|torch=2.12.0+cpu",
  "python_implementation": "CPython",
  "python_version": "3.12.3",
  "python_build": [
    "main",
    "Jun 19 2026 12:46:00"
  ],
  "python_compiler": "GCC 13.3.0",
  "pip_version": "24.0",
  "torch_version": "2.12.0+cpu",
  "torch_build_configuration_sha256": "sha256:7e6be40c3827e6ae8a91057472c3f401a6fe4a382bd1bf5b332e735261334745",
  "mkl_available": true,
  "openmp_available": true,
  "mkldnn_available": true,
  "ATEN_CPU_CAPABILITY": "avx2",
  "actual_atten_cpu_capability": "AVX2",
  "MKL_CBWR": "COMPATIBLE",
  "torch_num_threads": 1,
  "torch_num_interop_threads": 1,
  "OMP_NUM_THREADS": "1",
  "MKL_NUM_THREADS": "1",
  "OPENBLAS_NUM_THREADS": "1",
  "NUMEXPR_NUM_THREADS": "1",
  "mkldnn_enabled": false,
  "deterministic_algorithms": true,
  "deterministic_warn_only": false,
  "optimizer_foreach": false,
  "optimizer_fused": false
}
